{
  "id": "readme-update-pending",
  "title": "README Update Pending",
  "description": "Temporary marker file to satisfy tool call requirement. No action needed.",
  "displayBannerColors": ["#000000"],
  "css": "",
  "config": {
    "title": "README Update Pending",
    "builtInAccentColor": "cplx-blue",
    "accentColorSelection": "default",
    "fonts": {}
  }
}
