{
  "id": "evergreen-forest",
  "title": "Evergreen Forest",
  "description": "A calming nature-inspired theme with deep forest greens and earthy tones",
  "displayBannerColors": ["#1a2f1a", "#2d5a3d", "#4a7c59", "#8b4513"],
  "css": ":root { --forest-bg: #1a2f1a; --forest-surface: #2d5a3d; --forest-accent: #4a7c59; --forest-brown: #8b4513; --forest-text: #f0f4f0; --forest-muted: #a8b8a8; --forest-light: #6b8e6b; } body { background: var(--forest-bg) !important; color: var(--forest-text) !important; font-family: 'Georgia', serif; } .bg-white, [data-testid='thread-content'] { background: var(--forest-surface) !important; border: 1px solid var(--forest-accent); border-radius: 8px; box-shadow: 0 4px 12px rgba(0, 0, 0, 0.3); } .text-gray-900, .text-black { color: var(--forest-text) !important; } .text-gray-600, .text-gray-500 { color: var(--forest-muted) !important; } .border-gray-200, .border-gray-300 { border-color: var(--forest-accent) !important; } .hover\\:bg-gray-50:hover, .hover\\:bg-gray-100:hover { background: rgba(74, 124, 89, 0.2) !important; } a, .text-blue-600 { color: var(--forest-light) !important; } button { background: var(--forest-accent) !important; color: white !important; border: 2px solid var(--forest-brown) !important; border-radius: 6px; transition: all 0.3s ease; } button:hover { background: var(--forest-brown) !important; transform: translateY(-2px); } .bg-green-50 { background: rgba(74, 124, 89, 0.1) !important; } .text-green-600, .text-green-700 { color: var(--forest-light) !important; }",
  "config": {
    "title": "Evergreen Forest",
    "accentColorSelection": "custom",
    "accentColor": "#4a7c59",
    "builtInAccentColor": "cplx-blue",
    "fonts": {
      "ui": "Georgia, serif",
      "mono": "Consolas, monospace"
    },
    "enhanceThreadTypography": true,
    "customCss": ":root { --forest-bg: #1a2f1a; --forest-surface: #2d5a3d; --forest-accent: #4a7c59; --forest-brown: #8b4513; --forest-text: #f0f4f0; --forest-muted: #a8b8a8; --forest-light: #6b8e6b; } body { background: var(--forest-bg) !important; color: var(--forest-text) !important; font-family: 'Georgia', serif; } .bg-white, [data-testid='thread-content'] { background: var(--forest-surface) !important; border: 1px solid var(--forest-accent); border-radius: 8px; box-shadow: 0 4px 12px rgba(0, 0, 0, 0.3); } .text-gray-900, .text-black { color: var(--forest-text) !important; } .text-gray-600, .text-gray-500 { color: var(--forest-muted) !important; } .border-gray-200, .border-gray-300 { border-color: var(--forest-accent) !important; } .hover\\:bg-gray-50:hover, .hover\\:bg-gray-100:hover { background: rgba(74, 124, 89, 0.2) !important; } a, .text-blue-600 { color: var(--forest-light) !important; } button { background: var(--forest-accent) !important; color: white !important; border: 2px solid var(--forest-brown) !important; border-radius: 6px; transition: all 0.3s ease; } button:hover { background: var(--forest-brown) !important; transform: translateY(-2px); } .bg-green-50 { background: rgba(74, 124, 89, 0.1) !important; } .text-green-600, .text-green-700 { color: var(--forest-light) !important; }"
  }
}